{
  "deck": "seminar-day1/outputs/Day1_保険営業から社長の相談役へ.pptx",
  "totalScore": 93,
  "band": "external",
  "dimensions": {
    "messageLogic": {
      "score": 24,
      "max": 25,
      "notes": "全32枚が1スライド1メッセージ。タイトルは全て結論か問い（P13『会計と聞いて、こう感じていませんか？』、P19『担い手の数なら、あなたたちが圧倒的です』等、トピックラベルなし）。全体はBAB（保険営業→相談役、橋＝会計）に§4のSCQA（失敗物語）を入れ子。縦読みテスト：タイトルだけでP1→P32が一本の物語として読め、ゴール行動（今夜BSを書いてFB投稿）にP31→P32で着地。転換点のダーク配置（P6/P9/P10/P17）は感情曲線と一致し、notesに根拠記録済み。-1：P9-P11のmessage3連はどん底の谷として意図的だが、リズムとしては単調のリスクが残る（notesで正当化済み）。"
    },
    "visualIntegrity": {
      "score": 23,
      "max": 25,
      "notes": "全32枚を独立視点の検査2系統でレンダ目視。溢れ0・重なり0・AI-tell 0・プレースホルダ0・文字化け0。初回レンダで検出したP31『持ち物』泣き別れとP19注記の本文連結は修正済み（resolved）。残る軽微2点：P4のタイトルと図の間の余白がやや大きい（意匠許容範囲）、P19左下の単位脚注が2行に折り返しフッタに近い（重なりなし）。"
    },
    "designFidelity": {
      "score": 19,
      "max": 20,
      "notes": "wa-modern（和紙地×藍墨×朱アクセント・明朝見出し）をトークンのみで適用。サンドイッチ保持：ダーク8/32=25%（cover/cta/章扉2/転換点4）で予算内。ダーク隣接2箇所（P6-7、P9-10）はnotesで正当化された意図的連続。菱形kicker・chapter章扉のモチーフが全ページ一貫。強調は1スライド1主役・peak1枚（P27）で希少性維持。-1：ダーク連続2箇所は効果的だが信号の希少性をわずかに消費。"
    },
    "informationDesign": {
      "score": 18,
      "max": 20,
      "notes": "全スライドに視覚要素。図解は正準形準拠：P26=BS恒等式（identity、検査で高さ比2.61:1≈値比2.5:1を実測確認）、P28=STRAC家計版（2段恒等式、入れ子列が親箱に整合）、P19=実寸横棒（棒長比を画素実測で値に比例確認）、P24=決算書ミニチュアのGAPをtable代替。時間密度も整合（statement=3秒スライド、図解=dwell）。-2：saliency advisory 5件のうちP15は主役と脇役がほぼ拮抗（43.4 vs 43.9、目視では番号円＋朱見出しで判別可）、P19のsaliency警告はbarチャートでの領域誤特定（目視では主役棒が明確に支配）——lintの近似限界として受容をここに記録。"
    },
    "contentIntegrity": {
      "score": 9,
      "max": 10,
      "notes": "架空数値は全て縦計算一致を検証済み：P24ミニPL（当期120,000-72,000=48,000-36,000=12,000、前期も整合）、P26（2,500+1,000=3,500）、P28（30+70=100、50+20=70）、かつ『架空の例』を明記。実数値（税理士8.2万/FP延べ173万/後継者未定127万社/黒字休廃業約6割）は全て『概数・公表値』ラベル付き。強調対象の監査：P19の強調は聴衆側の実数（173万）で誇張なし、P9の10億円は講師自身の損害の自己開示で概算明記。有料講座の存在をP21で正直開示。-1：P20の出典が『経産省公表値』『民間調査』止まりで年次・調査名がない——外部配布前に付記推奨。"
    }
  },
  "visualQa": {
    "ran": true,
    "slides": [
      { "slide": 4, "issues": [{ "type": "margin", "detail": "タイトルとフロー図の間の空白帯がやや大きく間延びして見える（3ノードflowの構造上の余白。欠陥ではなく意匠許容範囲）", "severity": "minor", "resolved": false }] },
      { "slide": 19, "issues": [
        { "type": "other", "detail": "初回レンダ：出典注記が本文直後に改行なしで連結し視覚分離がなかった→単位脚注スロットへ移設して解消", "severity": "minor", "resolved": true },
        { "type": "margin", "detail": "単位脚注『万人（各団体公表値をもとにした概数）』が2行に折り返しフッタに近い（重なりなし・可読）", "severity": "minor", "resolved": false }
      ] },
      { "slide": 31, "issues": [{ "type": "other", "detail": "初回レンダ：STEP1本文で『持ち物』が持ち／物に泣き別れ→本文短縮で解消（typo-lint 0 splitsで機械確認済み）", "severity": "minor", "resolved": true }] }
    ]
  },
  "findings": [
    { "dimension": "contentIntegrity", "slide": 20, "issue": "『127万社』『約6割』の出典が組織種別のみで年次・調査名を欠く", "fix": "subに年次を付記する（例：『経産省推計（2025年時点の後継者未定・概数）』『東京商工リサーチ等の公表値（概数）』）——実配布前に講師が出典を確定させる" },
    { "dimension": "informationDesign", "slide": 15, "issue": "強調行（1『見るのは「これから」』）と3行目の顕著性がほぼ拮抗（saliency 43.4 vs 43.9）", "fix": "気になる場合は2・3行目のbodyを1行に短縮して主役の面積優位を作る（現状も番号円＋朱見出しで判別可能なため任意）" },
    { "dimension": "visualIntegrity", "slide": 19, "issue": "単位脚注が2行に折り返しフッタとの間が詰まって見える", "fix": "unitを『万人（公表値の概数）』に短縮して1行に収める" }
  ],
  "verdict": "Ship可（external・93点）。32枚全てが1メッセージ・結論タイトルで、BS恒等式／STRAC家計版の正準形図解は画素実測で数値比例を確認済み。数字は架空＝縦計算一致・実数＝概数ラベルの二重の誠実ガードが通っている。残る改善は3点のみで、最重要はP20の出典年次の確定（講師側の作業）。"
}
